{
  "project_name": "AttentionOS",
  "project_root": "F:\\prosjekter_MAIN\\AttentionOS",
  "project_type": "in_progress_project",
  "project_state_confidence": "HIGH_FOR_LOCAL_MVP_LOW_FOR_PRODUCTION",
  "current_phase": "Continuation pack filled",
  "last_action": "Filled Project_Continuation_Completion_Pack_Ultimate in repo root",
  "last_result": "PASS",
  "next_action": "Commit filled pack and continue with persistence/auth/privacy",
  "verification_level": "LOCAL_MVP_VERIFIED",
  "top_blocker": "Persistence auth consent privacy and real extension capture are not implemented",
  "build_status": "PASS",
  "runtime_status": "PASS_LOCAL_SMOKE",
  "test_status": "PASS",
  "risks": [
    "Prototype may be mistaken for production-ready",
    "Generated dependency folders are fragile",
    "Real user data requires privacy controls"
  ]
}
